rank_toplist,institution,country,identified_positions,senior_positions,state_time,institution_classification,female_ratio,female_ratio_senior_positions,main_data_set,world_region
233,"Department of Economics, George Washington University",United States of America,48,33,05.02.2020,University,29,27,1,North America
234,Institute for Fiscal Studies (IFS),United Kingdom of Great Britain and Northern Ireland,236,21,12.11.2020,Organization,33,43,0,Europe
236,"Faculté de droit, d'économie et de finance, Université du Luxembourg",Luxembourg,120,39,29.10.2020,University,39,18,1,Europe
237,Leibniz-Institut für Wirtschaftsforschung Halle (IWH),Germany,106,36,29.10.2020,Organization,25,8,0,Europe
238,"Division of Social Sciences, California Institute of Technology",United States of America,151,42,05.02.2020,University,35,26,1,North America
239,"Laboratory of Economics and Management (LEM), Scuola Superiore Sant'Anna",Italy,25,12,29.10.2020,University,40,33,1,Europe
240,"Economics Department, University of Rochester",United States of America,84,14,05.02.2020,University,20,29,1,North America
241,"Argyros School of Business and Economics, Chapman University",United States of America,102,45,05.02.2020,University,21,13,1,North America
243,"Wirtschaftswissenschaftliche Fakultät, Georg-August-Universität Göttingen",Germany,37,32,29.10.2020,University,22,22,1,Europe
244,"Fachbereich Wirtschaftswissenschaften, Universität Konstanz",Germany,83,19,29.10.2020,University,30,21,1,Europe
245,BI Handelshøyskolen,Norway,501,249,29.10.2020,University,31,29,1,Europe
246,"Institutet för Social Forskning (SOFI), Stockholms Universitet",Sweden,93,7,29.10.2020,University,48,29,1,Europe
247,Oesterreichische Nationalbank,Austria,40,4,05.11.2020,Bank,33,50,0,Europe
248,"Facultad de Economía, Universidad de los Andes",Colombia,42,33,05.02.2020,University,21,24,1,Rest of the World
249,"Department of Economics, University of Oregon",United States of America,107,16,05.02.2020,University,26,19,1,North America
250,Center for Economic Research and Graduate Education and Economics Institute (CERGE-EI),Czechia,62,29,29.10.2020,University,19,3,1,Europe
251,"Institut für Volkswirtschaftslehre, Johannes-Kepler-Universität Linz",Austria,36,13,29.10.2020,University,25,31,1,Europe
252,"Department of Economics, Simon Fraser University",Canada,34,27,05.02.2020,University,21,22,1,North America
253,"Department of Economics, University of Sheffield",United Kingdom of Great Britain and Northern Ireland,45,21,29.10.2020,University,31,24,1,Europe
254,Central University of Finance and Economics (CUFE),China,9,8,07.02.2020,University,33,38,1,Rest of the World
255,"Department of Economics and Business, Central European University",Hungary,51,16,29.10.2020,University,20,6,1,Europe
256,"Economics, New York University Abu Dhabi",United Arab Emirates,34,14,05.02.2020,University,26,7,1,Rest of the World
257,"Waikato Management School, University of Waikato",New Zealand,88,41,05.02.2020,Business School,39,24,1,Rest of the World
258,"Department Volkswirtschaftlehre, Universität Bern",Switzerland,56,16,29.10.2020,University,18,13,1,Europe
259,"Wirtschaftswissenschaftliche Fakultät, Leibniz Universität Hannover",Germany,192,55,29.10.2020,University,43,24,1,Europe
260,"École d'Économie, Université Clermont Auvergne",France,22,9,29.10.2020,University,41,33,1,Europe
261,"Facultad de Economía y Empresa, Universidad de Zaragoza",Spain,267,217,30.10.2020,University,47,45,1,Europe
262,"School of International and Public Affairs (SIPA), Columbia University",United States of America,563,176,05.02.2020,Business School,34,30,1,North America
263,"Department of Economics, Trinity College Dublin",Ireland,38,6,29.10.2020,University,32,50,1,Europe
264,Resources for the Future (RFF),International Organization,38,2,31.01.2020,Organization,29,50,0,North America
265,"Department of Economics, Emory University",United States of America,79,16,05.02.2020,University,34,38,1,North America
266,"Department of Agricultural and Consumer Economics, University of Illinois at Urbana-Champaign",United States of America,117,27,05.02.2020,University,29,30,1,North America
267,"Max-Planck-Institut zur Erforschung von Gemeinschaftsgütern, Max-Planck-Gesellschaft",Germany,149,12,29.10.2020,Organization,46,33,0,Europe
268,Athens University of Economics and Business (AUEB),Greece,207,126,29.10.2020,University,18,18,1,Europe
269,"Fisher College of Business, Ohio State University",United States of America,288,75,05.02.2020,Business School,29,27,1,North America
270,HEC Montréal (École des Hautes Études Commerciales),Canada,323,189,05.02.2020,University,32,32,1,North America
271,"Wirtschaftswissenschaftlichen Fakultät, Eberhard-Karls-Universität Tübingen",Germany,47,22,29.10.2020,University,28,23,1,Europe
272,"Department of Economics, Johns Hopkins University",United States of America,58,25,05.02.2020,University,19,8,1,North America
273,"Department of Economics, Iowa State University",United States of America,162,22,30.10.2020,University,28,14,1,North America
274,"Nationalekonomiska institutionen, Stockholms Universitet",Sweden,39,25,18.11.2020,University,23,20,1,Europe
275,"Faculty of Economic and Management Sciences, University of Pretoria",South Africa,160,45,05.02.2020,University,61,58,1,Rest of the World
276,"Institut Supérieur d'Économie et Management (ISEM), Université de Nice-Sophia Antipolis",France,66,25,26.10.2020,University,44,36,1,Europe
277,"Geneva School of Economics and Management, Université de Genève",Switzerland,97,52,29.10.2020,University,24,31,1,Europe
278,"Carey Business School, Johns Hopkins University",United States of America,132,48,05.02.2020,Business School,28,27,1,North America
279,"Faculty of Business and Economics, University of Hong Kong",China,138,70,05.02.2020,University,26,19,1,Rest of the World
280,"Facultad de Ciencia Económicas y Administrativas, Pontificia Universidad Católica de Chile",Chile,45,25,05.02.2020,University,13,12,1,Rest of the World
281,"Instituto Superior de Economia e Gestão (ISEG), Universidade de Lisboa",Portugal,244,94,26.10.2020,University,34,32,1,Europe
282,Singapore Management University,Singapore,6,3,05.02.2020,University,33,33,1,Rest of the World
283,"Department of Economics, International Business School, Brandeis University",United States of America,83,26,05.02.2020,University,31,35,1,North America
284,"Cass Business School, City University",United Kingdom of Great Britain and Northern Ireland,188,89,29.10.2020,Business School,30,26,1,Europe
285,"College of Business and Behavioral Science, Clemson University",United States of America,136,56,05.02.2020,University,35,27,1,North America
286,"Department of Economics, Tufts University",United States of America,45,20,05.02.2020,University,31,35,1,North America
287,Szkoła Główna Handlowa w Warszawie,Poland,31,28,29.10.2020,University,42,43,1,Europe
288,"École des Sciences de la Gestion (ESG), Université du Québec à Montréal (UQAM)",Canada,328,280,05.02.2020,University,41,42,1,North America
289,"Department of Economics, University of Illinois at Urbana-Champaign",United States of America,139,20,05.02.2020,University,27,10,1,North America
290,"Groupe de Recherche en Économie Théorique et Appliquée (GREThA), Université de Bordeaux",France,132,19,29.10.2020,University,31,16,1,Europe
291,"Dipartimento di Scienze Economiche ""Marco Fanno"", Università degli Studi di Padova",Italy,67,54,29.10.2020,University,25,19,1,Europe
292,"Dipartimento di Economia e Finanza (DEF), Libera Università Internazionale degli Studi Sociali Guido Carli (LUISS)",Italy,31,21,29.10.2020,University,19,19,1,Europe
293,"Business School, University of Sydney",Australia,455,115,26.10.2020,Business School,35,36,1,Rest of the World
294,"Department of Economics, University of Alberta",Canada,28,18,05.02.2020,University,29,39,1,North America
295,"Fuqua School of Business, Duke University",United States of America,117,75,05.02.2020,Business School,22,21,1,North America
296,"Scuola di Economia e Statistica, Università degli Studi di Milano-Bicocca",Italy,295,86,29.10.2020,University,43,44,1,Europe
297,"Théorie Économique, Modélisation, Application (THEMA), Université de Cergy-Pontoise",France,117,28,29.10.2020,University,32,25,1,Europe
298,Brookings Institution,United States of America,257,2,31.01.2020,Organization,27,50,0,North America
299,"Rechts- und Wirtschaftswissenschaftliche Fakultät, Universität Bayreuth",Germany,20,7,29.10.2020,University,10,0,1,Europe
300,"Facoltà di Economia, ""Sapienza"" Università di Roma",Italy,201,124,29.10.2020,University,39,39,1,Europe